{
  "$schema": "./system-map.schema.json",
  "schemaVersion": "0.1.0",
  "modelVersion": "1.1.0",
  "title": "AI-Native Design System V1.1 Architecture",
  "status": "active",
  "capturedAt": "2026-07-29",
  "description": "Canonical graph of the implemented role-aware reuse-first runtime with flow-specific Context Packs. Architecture documentation is excluded from normal prompt execution.",
  "languagePolicy": {
    "artifacts": "en",
    "conversation": "pl"
  },
  "architectureStates": [
    {
      "id": "current",
      "title": "Implemented V1.1",
      "status": "active",
      "description": "Mechanisms present in repository code and operational rules."
    },
    {
      "id": "target",
      "title": "Future Change",
      "status": "inactive",
      "description": "Reserved for explicitly proposed mechanisms; no target nodes are active in this model."
    }
  ],
  "nodes": [
    {
      "id": "prompt.user-request",
      "title": "User Prompt",
      "type": "prompt",
      "scope": "framework",
      "concerns": [
        "agent-runtime"
      ],
      "status": "current",
      "architectureState": "current",
      "sourcePaths": [],
      "ownership": {
        "owner": "User",
        "readers": [
          "AI agent",
          "Design engineer"
        ],
        "writers": [
          "User"
        ],
        "validatorNodeIds": [],
        "contextCost": "none"
      },
      "metadata": {
        "problem": "The runtime needs one explicit request boundary."
      }
    },
    {
      "id": "input.guide-identity",
      "title": "Exact Guide Identity",
      "type": "input",
      "scope": "framework",
      "concerns": [
        "agent-runtime"
      ],
      "status": "current",
      "architectureState": "current",
      "sourcePaths": [
        "src/components/_internal/dev/ComponentInfoLayer.astro",
        "src/components/_internal/dev/GridVisualizer.astro"
      ],
      "ownership": {
        "owner": "Design-system Guides",
        "readers": [
          "AI agent",
          "Design engineer"
        ],
        "writers": [
          "Repository maintainers"
        ],
        "validatorNodeIds": [],
        "contextCost": "none"
      },
      "metadata": {
        "problem": "Copied component identities reduce ambiguous discovery."
      }
    },
    {
      "id": "router.request-classifier",
      "title": "Request Classifier",
      "type": "router",
      "scope": "framework",
      "concerns": [
        "agent-runtime"
      ],
      "status": "current",
      "architectureState": "current",
      "sourcePaths": [
        "scripts/route-agent-request.mjs",
        "AGENTIC-RULES.json"
      ],
      "ownership": {
        "owner": "AI-native runtime",
        "readers": [
          "AI agent",
          "Design engineer"
        ],
        "writers": [
          "Repository maintainers"
        ],
        "validatorNodeIds": [
          "validator.agent-runtime"
        ],
        "contextCost": "low"
      },
      "metadata": {
        "problem": "Requests need role-aware target extraction and explicit constraints without a second model call.",
        "primaryFor": [
          "request-routing"
        ]
      }
    },
    {
      "id": "artifact.task-contract",
      "title": "Task Contract",
      "type": "artifact",
      "scope": "framework",
      "concerns": [
        "agent-runtime"
      ],
      "status": "current",
      "architectureState": "current",
      "sourcePaths": [
        "architecture/agent-task.schema.json"
      ],
      "ownership": {
        "owner": "AI-native runtime",
        "readers": [
          "AI agent",
          "Design engineer"
        ],
        "writers": [
          "Repository maintainers"
        ],
        "validatorNodeIds": [
          "validator.agent-runtime"
        ],
        "contextCost": "low"
      },
      "metadata": {
        "problem": "Execution needs an auditable intent, permission, budget, and validation scope.",
        "primaryFor": [
          "task-contract"
        ],
        "contractVersion": "1.1.0",
        "targetRoles": [
          "primary",
          "dependency",
          "context"
        ],
        "constraintFields": [
          "prohibitNewComponents",
          "prohibitedCreations"
        ],
        "compatibleVersions": [
          "1.0.0",
          "1.1.0"
        ]
      }
    },
    {
      "id": "router.context-resolver",
      "title": "Focused Context Resolver",
      "type": "router",
      "scope": "framework",
      "concerns": [
        "agent-runtime"
      ],
      "status": "current",
      "architectureState": "current",
      "sourcePaths": [
        "scripts/resolve-agent-context.mjs",
        "scripts/lib/agent-runtime.mjs"
      ],
      "ownership": {
        "owner": "AI-native runtime",
        "readers": [
          "AI agent",
          "Design engineer"
        ],
        "writers": [
          "Repository maintainers"
        ],
        "validatorNodeIds": [
          "validator.agent-runtime"
        ],
        "contextCost": "low"
      },
      "metadata": {
        "problem": "The agent must retrieve selected records instead of loading the repository.",
        "primaryFor": [
          "context-resolution"
        ]
      }
    },
    {
      "id": "artifact.context-pack",
      "title": "Bounded Context Pack",
      "type": "artifact",
      "scope": "framework",
      "concerns": [
        "agent-runtime"
      ],
      "status": "current",
      "architectureState": "current",
      "sourcePaths": [
        "scripts/lib/agent-runtime.mjs"
      ],
      "ownership": {
        "owner": "AI-native runtime",
        "readers": [
          "AI agent",
          "Design engineer"
        ],
        "writers": [
          "Repository maintainers"
        ],
        "validatorNodeIds": [
          "validator.agent-runtime"
        ],
        "contextCost": "medium"
      },
      "metadata": {
        "problem": "Execution needs an explicit byte-counted read plan, flow phase, skips, validators, and missing input.",
        "budgetsBytes": [
          4096,
          12288,
          40960,
          102400
        ],
        "materializedSourceBudgetsBytes": {
          "exact-edit": 16384,
          "reuse": 65536,
          "compose": 262144,
          "repair": 196608,
          "extend": 524288,
          "create": 786432
        },
        "fields": [
          "requiredReads",
          "readPlan",
          "declaredSourceBytes",
          "sourceLimitBytes",
          "phase",
          "nextStep"
        ]
      }
    },
    {
      "id": "source.component-registry",
      "title": "Component Registry and Readiness",
      "type": "source-of-truth",
      "scope": "framework",
      "concerns": [
        "component-discovery",
        "component-readiness"
      ],
      "status": "current",
      "architectureState": "current",
      "sourcePaths": [
        "src/data/design-system/componentArchitecture.json"
      ],
      "ownership": {
        "owner": "AI-native runtime",
        "readers": [
          "AI agent",
          "Design engineer"
        ],
        "writers": [
          "Repository maintainers"
        ],
        "validatorNodeIds": [
          "validator.component-architecture"
        ],
        "contextCost": "low"
      },
      "metadata": {
        "problem": "Named reuse needs one compact discovery index and current readiness projection.",
        "primaryFor": [
          "component-discovery",
          "component-readiness"
        ]
      }
    },
    {
      "id": "source.css-variables",
      "title": "CSS Variable Foundations",
      "type": "source-of-truth",
      "scope": "framework",
      "concerns": [
        "design-values"
      ],
      "status": "current",
      "architectureState": "current",
      "sourcePaths": [
        "src/styles/tokens"
      ],
      "ownership": {
        "owner": "AI-native runtime",
        "readers": [
          "AI agent",
          "Design engineer"
        ],
        "writers": [
          "Repository maintainers"
        ],
        "validatorNodeIds": [],
        "contextCost": "low"
      },
      "metadata": {
        "problem": "Exact token edits need one value authority.",
        "primaryFor": [
          "design-values"
        ],
        "pathKind": "directory"
      }
    },
    {
      "id": "source.astro-components",
      "title": "Astro Component Sources",
      "type": "source-of-truth",
      "scope": "framework",
      "concerns": [
        "component-api",
        "runtime"
      ],
      "status": "current",
      "architectureState": "current",
      "sourcePaths": [
        "src/components"
      ],
      "ownership": {
        "owner": "AI-native runtime",
        "readers": [
          "AI agent",
          "Design engineer"
        ],
        "writers": [
          "Repository maintainers"
        ],
        "validatorNodeIds": [
          "validator.component-architecture"
        ],
        "contextCost": "low"
      },
      "metadata": {
        "problem": "Executable APIs, semantics, accessibility, and runtime need one authority.",
        "primaryFor": [
          "component-api",
          "component-runtime"
        ],
        "pathKind": "directory"
      }
    },
    {
      "id": "source.category-rules",
      "title": "Selected Category Rules",
      "type": "source-of-truth",
      "scope": "framework",
      "concerns": [
        "repair-guidance",
        "creation-guidance"
      ],
      "status": "current",
      "architectureState": "current",
      "sourcePaths": [
        ".agentic-rules"
      ],
      "ownership": {
        "owner": "AI-native runtime",
        "readers": [
          "AI agent",
          "Design engineer"
        ],
        "writers": [
          "Repository maintainers"
        ],
        "validatorNodeIds": [],
        "contextCost": "medium"
      },
      "metadata": {